{
  "commandId": "11111111-1111-4111-8111-111111111113",
  "schemaVersion": 1,
  "commandType": "browse_files",
  "roomId": "22222222-2222-4222-8222-222222222222",
  "targetDeviceId": "33333333-3333-4333-8333-333333333333",
  "issuedByUserId": "44444444-4444-4444-8444-444444444444",
  "idempotencyKey": "cmd:browse:22222222-2222-4222-8222-222222222222:documents:0001",
  "createdAt": "2026-07-11T09:02:00Z",
  "expiresAt": "2026-07-11T09:12:00Z",
  "payload": {
    "relativePath": "documents",
    "pageSize": 200,
    "cursor": null
  }
}
