{
  "commandId": "11111111-1111-4111-8111-111111111112",
  "schemaVersion": 1,
  "commandType": "apply_decisions",
  "roomId": "22222222-2222-4222-8222-222222222222",
  "targetDeviceId": "33333333-3333-4333-8333-333333333333",
  "issuedByUserId": "44444444-4444-4444-8444-444444444444",
  "idempotencyKey": "cmd:apply-decisions:22222222-2222-4222-8222-222222222222:0001",
  "createdAt": "2026-07-11T09:01:00Z",
  "expiresAt": "2026-07-11T09:11:00Z",
  "payload": {
    "proposalBatchId": "55555555-5555-4555-8555-555555555555",
    "decisions": [
      {
        "proposalId": "move:0123456789abcdef",
        "decision": "approved"
      },
      {
        "proposalId": "move:fedcba9876543210",
        "decision": "rejected",
        "reason": "Keep this file in the inbox for now."
      }
    ]
  }
}
