{
  "commandId": "11111111-1111-4111-8111-111111111115",
  "schemaVersion": 1,
  "commandType": "cancel_transfer",
  "roomId": "22222222-2222-4222-8222-222222222222",
  "targetDeviceId": "33333333-3333-4333-8333-333333333333",
  "issuedByUserId": "44444444-4444-4444-8444-444444444444",
  "idempotencyKey": "cmd:cancel-transfer:66666666-6666-4666-8666-666666666666:0001",
  "createdAt": "2026-07-11T09:04:00Z",
  "expiresAt": "2026-07-11T09:14:00Z",
  "payload": {
    "transferSessionId": "66666666-6666-4666-8666-666666666666",
    "reason": "User cancelled from mobile."
  }
}
