{
  "commandId": "11111111-1111-4111-8111-111111111114",
  "schemaVersion": 1,
  "commandType": "download_file",
  "roomId": "22222222-2222-4222-8222-222222222222",
  "targetDeviceId": "33333333-3333-4333-8333-333333333333",
  "issuedByUserId": "44444444-4444-4444-8444-444444444444",
  "idempotencyKey": "cmd:download:22222222-2222-4222-8222-222222222222:documents/report.pdf:0001",
  "createdAt": "2026-07-11T09:03:00Z",
  "expiresAt": "2026-07-11T09:13:00Z",
  "payload": {
    "relativePath": "documents/report.pdf",
    "transferSessionId": "66666666-6666-4666-8666-666666666666",
    "expectedSizeBytes": 524288,
    "expectedModifiedUnixMs": 1783760400000,
    "maxBytes": 104857600
  }
}
